{
  "schemaVersion": "1.0",
  "policyVersion": "1.1.1",
  "adapterVersion": "1.0.0",
  "sources": [
    {
      "id": "agents-general",
      "path": "AGENTS.md",
      "heading": "1. Scope and precedence",
      "normalizedSha256": "6260e9fb5acb7fad47322229e3e71a4a531fd091599844c7c4071ff173aad992"
    },
    {
      "id": "agents-autonomous",
      "path": "AGENTS.md",
      "heading": "8. Optional `$cubica` workflow",
      "normalizedSha256": "6da8bc7364d39053472b72b73a640880995d185509377bd7abbe908cf2d66e96"
    },
    {
      "id": "agents-adr-sync",
      "path": "AGENTS.md",
      "heading": "4. Architecture and documentation",
      "normalizedSha256": "f7cb597b847a02864dd05c0037276870a45e7bdb4bfbea153b13cfcf36c6eac9"
    },
    {
      "id": "agents-temp",
      "path": "AGENTS.md",
      "heading": "9. Temporary files",
      "normalizedSha256": "4fa8b179745b8b8dbfe6aedc8b16c29c741f3dea59decaec3f6ebbaffdde25b0"
    },
    {
      "id": "agents-contracts",
      "path": "AGENTS.md",
      "heading": "5. Code and contracts",
      "normalizedSha256": "51e5893a35d6284951ec8509684d7bd5341ea4288a5ac440b03800114bb01d80"
    },
    {
      "id": "agents-execution",
      "path": "AGENTS.md",
      "heading": "6. Execution and verification",
      "normalizedSha256": "71ece2cd74685506b611a23037090562a9a51c54213b393787756edfcaff055d"
    },
    {
      "id": "architecture-lifecycle",
      "path": "docs/architecture/AGENTS.md",
      "heading": "Жизненный цикл ADR",
      "normalizedSha256": "53dfd3b20191764438a4b14a221849ce9cf8cfedcc70ffd074c000829ad1fe1b"
    },
    {
      "id": "adr-031-decision",
      "path": "docs/architecture/adrs/031-lightweight-task-plan-and-handoff-system.md",
      "heading": "Решение",
      "normalizedSha256": "c9abd0cea845d8ac8f4d3113432edfe7461e91c3f84a948dd26de18cfb8665aa"
    },
    {
      "id": "adr-068-decision",
      "path": "docs/architecture/adrs/068-human-approved-autonomous-agent-workflow.md",
      "heading": "Решение",
      "normalizedSha256": "83a0cf0b91bf71ff993a5a0c4f1557ba542c01a1837e50f1f08183a42a9df343"
    },
    {
      "id": "adr-069-decision",
      "path": "docs/architecture/adrs/069-managed-external-skill-adaptation.md",
      "heading": "Решение",
      "normalizedSha256": "762ee2d417a6bc56a225f2e490c12f4d266b2e6287ee7b9276092b288fdbcb33"
    },
    {
      "id": "task-format",
      "path": "docs/tasks/README.md",
      "heading": "5. Формат рабочей задачи",
      "normalizedSha256": "29db3111ceb4bbca0ecbf00cf5437da45a305dd297e78d5eb3bf058c6a370a15"
    },
    {
      "id": "task-hierarchy",
      "path": "docs/tasks/README.md",
      "heading": "6. Родительские и дочерние задачи",
      "normalizedSha256": "e00752b874662204e044c97fb576f7cb55948076ca5a67a690cf3b6f1b91117a"
    },
    {
      "id": "task-approval",
      "path": "docs/tasks/README.md",
      "heading": "7. Согласование и автономное исполнение",
      "normalizedSha256": "eec967eb7a9a5558bf75118e2c24a689a645f0847a99d0318a6303c588a93b4c"
    }
  ],
  "rules": [
    {
      "id": "precedence.project-rules",
      "severity": "block",
      "tags": [
        "global"
      ],
      "statement": "Прямые указания пользователя, ближайший AGENTS.md и действующие ADR имеют приоритет над внешним навыком.",
      "remediation": "Удалить или заменить внешнее требование, которое меняет проектный порядок приоритетов.",
      "sourceIds": [
        "agents-general",
        "adr-069-decision"
      ]
    },
    {
      "id": "authority.architecture-human",
      "severity": "block",
      "tags": [
        "architecture",
        "planning",
        "global"
      ],
      "statement": "Архитектурные решения согласуются с человеком и фиксируются в ADR с синхронным обновлением PROJECT_ARCHITECTURE.md.",
      "remediation": "Заменить автономное архитектурное решение остановкой затронутой части и подготовкой ADR.",
      "sourceIds": [
        "agents-adr-sync",
        "architecture-lifecycle",
        "adr-068-decision"
      ]
    },
    {
      "id": "planning.tsk-only",
      "severity": "block",
      "tags": [
        "planning",
        "artifacts"
      ],
      "statement": "Постоянный общий план хранится в корневом TSK; отдельные PLN, ExecPlan и параллельные плановые иерархии не создаются.",
      "remediation": "Проецировать полезную декомпозицию в Plan или Execution существующего TSK и временные пакеты в .tmp.",
      "sourceIds": [
        "adr-031-decision",
        "adr-068-decision",
        "task-format",
        "task-hierarchy"
      ]
    },
    {
      "id": "activation.cubica-explicit",
      "severity": "block",
      "tags": [
        "activation",
        "orchestration",
        "global"
      ],
      "statement": "$cubica включается только по явному указанию пользователя.",
      "remediation": "Удалить автоматический вызов $cubica; специализированный навык должен выполнять только свою способность.",
      "sourceIds": [
        "agents-autonomous",
        "adr-068-decision"
      ]
    },
    {
      "id": "activation.specialists-automatic",
      "severity": "guidance",
      "tags": [
        "activation",
        "global"
      ],
      "statement": "Допущенные специализированные навыки могут включаться автоматически через точное описание.",
      "remediation": "Сузить description до конкретных симптомов и задач, исключив мета-оркестрацию.",
      "sourceIds": [
        "agents-autonomous",
        "adr-069-decision"
      ]
    },
    {
      "id": "activation.candidates-inert",
      "severity": "block",
      "tags": [
        "activation",
        "adaptation",
        "global"
      ],
      "statement": "Неадаптированный внешний навык из skill-candidates является только референсом и не может выполняться, включаться или попадать в путь автоматического обнаружения.",
      "remediation": "Оставить точный снимок в skill-candidates и материализовать отдельную очищенную проектную версию в skills после смысловой адаптации.",
      "sourceIds": [
        "agents-general",
        "adr-069-decision"
      ]
    },
    {
      "id": "orchestration.no-meta-bootstrap",
      "severity": "block",
      "tags": [
        "orchestration",
        "subagents",
        "planning",
        "activation"
      ],
      "statement": "Специализированный навык не вводит обязательный сквозной процесс, не проверяет навыки перед каждым ответом и не запускает собственную иерархию субагентов.",
      "remediation": "Заблокировать мета-навык либо извлечь из него узкую способность без bootstrap-инструкций.",
      "sourceIds": [
        "adr-068-decision",
        "adr-069-decision"
      ]
    },
    {
      "id": "subagents.lifecycle",
      "severity": "review",
      "tags": [
        "subagents",
        "orchestration"
      ],
      "statement": "Запущенные субагенты получают ограниченное задание, проверяются главным агентом и явно закрываются.",
      "remediation": "Добавить границы задания, проверку различия и явное завершение либо удалить делегирование из навыка.",
      "sourceIds": [
        "agents-execution",
        "adr-068-decision"
      ]
    },
    {
      "id": "operations.git-state",
      "severity": "review",
      "tags": [
        "git",
        "delivery",
        "debugging"
      ],
      "statement": "Внешний навык не должен автоматически менять ветку, рабочее дерево, историю, создавать commit, push, PR или worktree.",
      "remediation": "Заменить действие рекомендацией проверить состояние и выполнить операцию только по прямому запросу и с учетом локальных правил.",
      "sourceIds": [
        "agents-execution",
        "adr-069-decision"
      ]
    },
    {
      "id": "operations.destructive-approval",
      "severity": "block",
      "tags": [
        "security",
        "git",
        "delivery",
        "global"
      ],
      "statement": "Разрушительные, необратимые внешние операции, права и секреты требуют отдельного подтверждения.",
      "remediation": "Остановить затронутую операцию и запросить разрешение, продолжая независимую безопасную работу.",
      "sourceIds": [
        "adr-068-decision",
        "task-approval"
      ]
    },
    {
      "id": "verification.risk-based",
      "severity": "review",
      "tags": [
        "testing",
        "verification",
        "debugging",
        "global"
      ],
      "statement": "Доказательство выбирается по риску и области изменения; нельзя безусловно требовать полный набор тестов после каждой локальной правки.",
      "remediation": "Требовать свежую достаточную проверку конкретного утверждения и честно указывать непроверенные границы.",
      "sourceIds": [
        "agents-execution",
        "adr-068-decision"
      ]
    },
    {
      "id": "data.schema-ssot",
      "severity": "block",
      "tags": [
        "contracts",
        "schema",
        "architecture"
      ],
      "statement": "Декларативные контракты и JSON Schema нельзя заменять изолированной императивной проверкой.",
      "remediation": "Расширить каноническую схему и валидировать стандартным JSON Schema validator.",
      "sourceIds": [
        "agents-contracts"
      ]
    },
    {
      "id": "artifacts.temporary-root",
      "severity": "review",
      "tags": [
        "artifacts",
        "debugging",
        "testing",
        "global"
      ],
      "statement": "Временные файлы создаются только в .tmp и очищаются после использования.",
      "remediation": "Перенести временный артефакт в .tmp либо оформить значимый результат как постоянный артефакт задачи.",
      "sourceIds": [
        "agents-temp"
      ]
    },
    {
      "id": "adaptation.materialize",
      "severity": "block",
      "tags": [
        "adaptation",
        "global"
      ],
      "statement": "Активный навык не должен содержать в одном контексте конфликтующее upstream-требование и противоположную проектную обертку.",